question,answer
"What is PHI under HIPAA?","PHI stands for Protected Health Information, which includes any identifiable health data such as medical records, billing information, and lab results."
"Who must comply with HIPAA?","Covered entities such as healthcare providers, health plans, and healthcare clearinghouses, as well as their business associates, must comply with HIPAA."
"What is the HIPAA Privacy Rule?","The Privacy Rule establishes national standards to protect individuals' medical records and other personal health information."
"What is the HIPAA Security Rule?","The Security Rule sets standards for safeguarding electronic PHI through administrative, physical, and technical safeguards."
"What is a HIPAA breach?","A HIPAA breach is an impermissible use or disclosure of PHI that compromises the security or privacy of the information."